 <!DOCTYPE dataset SYSTEM "./mychart.dtd">
<dataset>
	<TB_ARTISTA COD_ARTISTA="1" DSC_TIPO="MASCULINO_SOLO" NOM_ARTISTA="Justin Timberlake" />
	<TB_ARTISTA COD_ARTISTA="2" DSC_TIPO="FEMININO_SOLO" NOM_ARTISTA="Rihanna" />

	<TB_CANCAO DSC_TITULO="Rehab" COD_CANCAO="1" />
	<TB_CANCAO DSC_TITULO="Unfaithful" COD_CANCAO="2" />

	<TB_ARTISTA_CANCAO COD_CANCAO="1" COD_ARTISTA="2" NUM_ORDEM="0" />
	<TB_ARTISTA_CANCAO COD_CANCAO="1" COD_ARTISTA="1" NUM_ORDEM="1" />
	<TB_ARTISTA_CANCAO COD_CANCAO="2" COD_ARTISTA="2" NUM_ORDEM="0" />
</dataset>