<!DOCTYPE dataset SYSTEM "./mychart.dtd">
<dataset>
	<TB_ARTISTA COD_ARTISTA="1" DSC_TIPO="MASCULINO_SOLO" NOM_ARTISTA="Justin Timberlake" />
	<TB_ARTISTA COD_ARTISTA="2" DSC_TIPO="FEMININO_SOLO" NOM_ARTISTA="Rihanna" />

	<TB_CANCAO DSC_TITULO="Rehab" COD_CANCAO="1" />
	<TB_CANCAO DSC_TITULO="Unfaithful" COD_CANCAO="2" />

	<TB_ARTISTA_CANCAO COD_CANCAO="1" COD_ARTISTA="2" NUM_ORDEM="0" />
	<TB_ARTISTA_CANCAO COD_CANCAO="1" COD_ARTISTA="1" NUM_ORDEM="1" />
	<TB_ARTISTA_CANCAO COD_CANCAO="2" COD_ARTISTA="2" NUM_ORDEM="0" />

	<TB_TOP_MUSICAL DTA_INICIAL="2015-01-08" NUM_TOP_MUSICAL="2" />
	<TB_TOP_MUSICAL DTA_INICIAL="2015-01-01" DTA_FINAL="2014-01-07" NUM_PROXIMO_TOP_MUSICAL="2" NUM_TOP_MUSICAL="1" />

	<!-- 
		1º Top 
		1 Rihanna feat. Justin Timberlake - "Rehab" [ NEW ] [1ª Semana] [PP:1]
		2 Rihanna - "Unfaithful" [ NEW ] [1ª Semana] [PP:2]
	-->

	<TB_POSICAO NUM_MELHOR_POSICAO="1" COD_CANCAO="1" NUM_PERMANENCIA_TOTAL="1" NUM_TOP_MUSICAL="1"
		NUM_PERMANENCIA_MELHOR_POSICAO="1" NUM_POSICAO="1" />
	<TB_POSICAO NUM_MELHOR_POSICAO="2" COD_CANCAO="2" NUM_PERMANENCIA_TOTAL="1" NUM_TOP_MUSICAL="1"
		NUM_PERMANENCIA_MELHOR_POSICAO="1" NUM_POSICAO="2" />

	<TB_TOP_MUSICAL_TB_POSICAO TOPMUSICAL_NUM_TOP_MUSICAL="1" POSICOES_NUM_TOP_MUSICAL="1"
		POSICOES_COD_CANCAO="1" POSICOES_KEY="1" />
	<TB_TOP_MUSICAL_TB_POSICAO TOPMUSICAL_NUM_TOP_MUSICAL="1" POSICOES_NUM_TOP_MUSICAL="1"
		POSICOES_COD_CANCAO="2" POSICOES_KEY="2" />

	<!-- 
		2º Top
		1 Rihanna - "Unfaithful" [ +1 ] [2ª Semana] [PP:1]
		2 Rihanna feat. Justin Timberlake - "Rehab" [ -1 ] [2ª Semana] [PP:1]
	-->

	<TB_POSICAO NUM_MELHOR_POSICAO="1" COD_CANCAO="2" NUM_PERMANENCIA_TOTAL="2" NUM_TOP_MUSICAL="2"
		NUM_PERMANENCIA_MELHOR_POSICAO="1" NUM_POSICAO="1" />
	<TB_POSICAO NUM_MELHOR_POSICAO="2" COD_CANCAO="1" NUM_PERMANENCIA_TOTAL="2" NUM_TOP_MUSICAL="2"
		NUM_PERMANENCIA_MELHOR_POSICAO="1" NUM_POSICAO="2" />

	<TB_TOP_MUSICAL_TB_POSICAO TOPMUSICAL_NUM_TOP_MUSICAL="2" POSICOES_NUM_TOP_MUSICAL="2"
		POSICOES_COD_CANCAO="2" POSICOES_KEY="1" />
	<TB_TOP_MUSICAL_TB_POSICAO TOPMUSICAL_NUM_TOP_MUSICAL="2" POSICOES_NUM_TOP_MUSICAL="2"
		POSICOES_COD_CANCAO="1" POSICOES_KEY="2" />
</dataset>